{
  "filename": "quantum_intro.txt",
  "title": "Введение в квантовую механику",
  "description": "Краткое введение в основные принципы квантовой механики",
  "fileType": "txt",
  "mimeType": "text/plain",
  "size": 1024,
  "created": "2025-12-30T13:00:00",
  "updated": "2025-12-30T13:00:00",
  "author": "Демо-автор",
  "language": "ru",
  "category": "education",
  "tags": [
    "физика",
    "квантовая механика",
    "обучение",
    "введение"
  ],
  "keywords": [
    "квантовая механика",
    "принцип неопределенности",
    "волновая функция",
    "суперпозиция",
    "Гейзенберг",
    "Шрёдингер"
  ],
  "subject": "Квантовая физика",
  "abstract": "Документ представляет краткое введение в основные принципы квантовой механики, включая принцип неопределенности, волновую функцию, суперпозицию и квантование энергии. Рассматриваются практические применения и исторический контекст развития теории.",
  "tableOfContents": [
    {
      "title": "Введение",
      "level": 1,
      "summary": "Общее определение квантовой механики"
    },
    {
      "title": "Основные принципы",
      "level": 1,
      "summary": "Четыре фундаментальных принципа квантовой механики"
    },
    {
      "title": "Принцип неопределенности Гейзенберга",
      "level": 2
    },
    {
      "title": "Волновая функция",
      "level": 2
    },
    {
      "title": "Суперпозиция",
      "level": 2
    },
    {
      "title": "Квантование энергии",
      "level": 2
    },
    {
      "title": "Применения",
      "level": 1,
      "summary": "Практические применения квантовой механики"
    },
    {
      "title": "Исторический контекст",
      "level": 1,
      "summary": "Развитие квантовой механики в XX веке"
    }
  ],
  "status": "final",
  "importance": "high",
  "readingTime": 3,
  "wordCount": 150,
  "source": {
    "publisher": "Демо-библиотека",
    "publicationDate": "2025-12-30"
  },
  "notes": "Это демонстрационный файл для показа возможностей системы метаданных"
}
